Intent_id,Standard,Clause_or_control,Intent_type,Intent_statement,Evidence_examples,Strength,Mandatory,Applicability ,Exclusion_Justified,Process,Action_Title,compliance_status
INT-04-01,ISO27001_2022,4.1,governance,External issues relevant to the organizations purpose are determined,"Context analysis document, external issues register",Strong,Yes,Applicable,,Governance & Policy,External issues relevant to the organizations purpose are determined,Not Started
INT-04-02,ISO27001_2022,4.1,governance,Internal issues relevant to the organizations purpose are determined,"Context analysis document, internal issues register",Strong,Yes,Applicable,,Governance & Policy,Internal issues relevant to the organizations purpose are determined,Not Started
INT-04-03,ISO27001_2022,4.1,governance,External issues affecting the achievement of ISMS intended outcomes are determined,"Context analysis, risk inputs, threat landscape",Strong,Yes,Applicable,,Governance & Policy,External issues affecting the achievement of ISMS intended outcomes are determined,Not Started
INT-04-04,ISO27001_2022,4.1,governance,Internal issues affecting the achievement of ISMS intended outcomes are determined,"Context analysis, internal risk themes",Strong,Yes,Applicable,,Governance & Policy,Internal issues affecting the achievement of ISMS intended outcomes are determined,Not Started
INT-04-05,ISO27001_2022,4.2,governance,Interested parties relevant to the information security management system are determined,"Interested parties register, stakeholder analysis",Strong,Yes,Applicable,,Governance & Policy,Interested parties relevant to the information security management system are determined,Not Started
INT-04-06,ISO27001_2022,4.2,governance,Information security requirements of relevant interested parties are determined,"Requirements register, contracts, regulatory mappings",Strong,Yes,Applicable,,Governance & Policy,Information security requirements of relevant interested parties are determined,Not Started
INT-04-07,ISO27001_2022,4.2,governance,Legal requirements relevant to the information security management system are determined,"Legal register, compliance obligations",Strong,Yes,Applicable,,Governance & Policy,Legal requirements relevant to the information security management system are determined,Not Started
INT-04-08,ISO27001_2022,4.2,governance,Regulatory requirements relevant to the information security management system are determined,"Regulatory register, compliance matrix",Strong,Yes,Applicable,,Governance & Policy,Regulatory requirements relevant to the information security management system are determined,Not Started
INT-04-09,ISO27001_2022,4.2,governance,Contractual information security requirements are determined,"Contracts, SLAs, customer agreements",Strong,Yes,Applicable,,Governance & Policy,Contractual information security requirements are determined,Not Started
INT-04-10,ISO27001_2022,4.2,governance,Interested party requirements addressed through the information security management system are determined,"ISMS scope mapping, control applicability rationale",Strong,Yes,Applicable,,Governance & Policy,Interested party requirements addressed through the information security management system are determined,Not Started
INT-04-14,ISO27001_2022,4.3,governance,The ISMS scope is formally documented,ISMS Scope Statement,Strong,Yes,Applicable,,Governance & Policy,The ISMS scope is formally documented,Not Started
INT-04-15,ISO27001_2022,4.3,governance,Boundaries and applicability of the ISMS are clearly defined,Scope document,Strong,Yes,Applicable,,Governance & Policy,Boundaries and applicability of the ISMS are clearly defined,Not Started
INT-04-16,ISO27001_2022,4.3,governance,ISMS scope considers internal and external issues identified under Clause 4.1,Scope rationale,Strong,Yes,Applicable,,Governance & Policy,ISMS scope considers internal and external issues identified under Clause 4.1,Not Started
INT-04-17,ISO27001_2022,4.3,governance,ISMS scope considers interested party requirements identified under Clause 4.2,Scope rationale,Strong,Yes,Applicable,,Governance & Policy,ISMS scope considers interested party requirements identified under Clause 4.2,Not Started
INT-04-18,ISO27001_2022,4.3,governance,Interfaces and dependencies with external parties are identified within the scope definition,Scope documentation,Medium,Yes,Applicable,,Governance & Policy,Interfaces and dependencies with external parties are identified within the scope definition,Not Started
INT-04-19,ISO27001_2022,4.3,governance,A defined frequency exists for reviewing the ISMS scope,Scope procedure,Medium,Yes,Applicable,,Governance & Policy,A defined frequency exists for reviewing the ISMS scope,Not Started
INT-04-20,ISO27001_2022,4.3,governance,ISMS scope was reviewed within the last 12 months,Review records,Strong,Yes,Applicable,,Governance & Policy,ISMS scope was reviewed within the last 12 months,Not Started
INT-04-21,ISO27001_2022,4.3,governance,ISMS scope is approved by top management,Approval records,Strong,Yes,Applicable,,Governance & Policy,ISMS scope is approved by top management,Not Started
INT-04-22,ISO27001_2022,4.4,governance,An information security management system has been formally established,ISMS documentation,Strong,Yes,Applicable,,Governance & Policy,An information security management system has been formally established,Not Started
INT-04-23,ISO27001_2022,4.4,governance,ISMS processes are implemented across the defined scope,Process evidence,Strong,Yes,Applicable,,Governance & Policy,ISMS processes are implemented across the defined scope,Not Started
INT-04-24,ISO27001_2022,4.4,governance,ISMS processes are maintained on an ongoing basis,Operational records,Medium,Yes,Applicable,,Governance & Policy,ISMS processes are maintained on an ongoing basis,Not Started
INT-04-25,ISO27001_2022,4.4,governance,ISMS processes and their interactions are documented,"Process maps, procedures",Strong,Yes,Applicable,,Governance & Policy,ISMS processes and their interactions are documented,Not Started
INT-04-26,ISO27001_2022,4.4,governance,Interactions between ISMS processes are identified and documented,ISMS diagrams,Medium,Yes,Applicable,,Governance & Policy,Interactions between ISMS processes are identified and documented,Not Started
INT-04-27,ISO27001_2022,4.4,governance,A mechanism exists to continually improve the ISMS,"Management review records, corrective actions",Strong,Yes,Applicable,,Governance & Policy,A mechanism exists to continually improve the ISMS,Not Started
INT-05-01,ISO27001_2022,5.1,governance,Top management ensures the information security policy is established and aligned with the organizations strategic direction,"Approved Information Security Policy, strategy documents",Strong,Yes,Applicable,,Governance & Policy,Establish Information Security Policies,Not Started
INT-05-02,ISO27001_2022,5.1,governance,Information security objectives are established and compatible with the organizations strategic direction,"IS objectives document, management review records",Strong,Yes,Applicable,,Governance & Policy,Establish Information Security Policies,Not Started
INT-05-03,ISO27001_2022,5.1,governance,ISMS requirements are integrated into the organizations business processes,"Process documentation, governance framework",Medium,Yes,Applicable,,Governance & Policy,Establish Information Security Policies,Not Started
INT-05-04,ISO27001_2022,5.1,governance,Top management ensures necessary resources for the ISMS are allocated,"Budget approvals, funding decisions",Medium,Yes,Applicable,,Governance & Policy,Establish Information Security Policies,Not Started
INT-05-05,ISO27001_2022,5.1,governance,Top management ensures necessary resources for the ISMS are available,"Staffing records, tool availability, capacity plans",Medium,Yes,Applicable,,Governance & Policy,Establish Information Security Policies,Not Started
INT-05-06,ISO27001_2022,5.1,governance,Top management communicates the importance of effective information security management and ISMS conformity,"Emails, memos, town halls, signed statements",Strong,Yes,Applicable,,Governance & Policy,Establish Information Security Policies,Not Started
INT-05-07,ISO27001_2022,5.1,governance,Top management monitors whether the ISMS achieves its intended outcomes,"Management review outputs, KPI dashboards",Medium,Yes,Applicable,,Governance & Policy,Establish Information Security Policies,Not Started
INT-05-08,ISO27001_2022,5.1,governance,Top management directs and supports personnel contributing to ISMS effectiveness,"Role assignments, performance objectives",Medium,Yes,Applicable,,Governance & Policy,Establish Information Security Policies,Not Started
INT-05-09,ISO27001_2022,5.1,governance,Top management promotes continual improvement of the ISMS,"Improvement actions, management review minutes",Medium,Yes,Applicable,,Governance & Policy,Establish Information Security Policies,Not Started
INT-05-10,ISO27001_2022,5.1,governance,Relevant management roles are supported in demonstrating leadership related to information security,"Org chart, responsibility matrix",Medium,Yes,Applicable,,Governance & Policy,Establish Information Security Policies,Not Started
INT-04-01,ISO27001_2022,5.2,governance,An information security policy is formally documented and approved by top management,Approved information security policy,strong,Yes,,,Governance & Policy,Assign Security Roles & Responsibilities,Not Started
INT-04-02,ISO27001_2022,5.2,governance,The information security policy is communicated to relevant employees,Policy acknowledgement records or training,strong,Yes,,,Governance & Policy,Assign Security Roles & Responsibilities,Not Started
INT-04-03,ISO27001_2022,5.2,governance,The information security policy is reviewed at planned intervals or upon significant change,Policy review records,medium,Yes,,,Governance & Policy,Assign Security Roles & Responsibilities,Not Started
INT-04-04,ISO27001_2022,5.2,governance,The information security policy is available to relevant interested parties,Published policy or access logs,medium,Yes,,,Governance & Policy,Assign Security Roles & Responsibilities,Not Started
INT-05-01,ISO27001_2022,5.3,governance,Information security roles and responsibilities are formally defined and documented,Roles and responsibilities document or policy,strong,Yes,,,Governance & Policy,Segregate Conflicting Duties,Not Started
INT-05-02,ISO27001_2022,5.3,governance,Information security responsibilities are assigned to specific roles or individuals,Organizational chart or role assignments,strong,Yes,,,Governance & Policy,Segregate Conflicting Duties,Not Started
INT-05-03,ISO27001_2022,5.3,governance,Authority for information security decision-making is defined and communicated,Delegation of authority or governance documents,medium,Yes,,,Governance & Policy,Segregate Conflicting Duties,Not Started
INT-05-04,ISO27001_2022,5.3,governance,Top management ensures accountability for information security within the organization,Management review records or governance meeting minutes,medium,Yes,,,Governance & Policy,Segregate Conflicting Duties,Not Started
INT-05-05,ISO27001_2022,5.3,governance,Information security responsibilities are reviewed and updated when organizational changes occur,Role review records or change management documentation,weak,Yes,,,Governance & Policy,Segregate Conflicting Duties,Not Started
INT-06-01,ISO27001_2022,6.1.1,governance,Risks and opportunities that can affect the ISMS are identified,ISMS risk and opportunity register,strong,Yes,,,Risk Management,Risks and opportunities that can affect the ISMS are identified,Not Started
INT-06-02,ISO27001_2022,6.1.1,governance,Internal and external issues relevant to information security are considered when identifying risks,Context or risk input documentation,medium,Yes,,,Risk Management,Internal and external issues relevant to information security are considered when identifying risks,Not Started
INT-06-03,ISO27001_2022,6.1.1,governance,Requirements of interested parties are considered when identifying information security risks,Stakeholder requirements or compliance register,medium,Yes,,,Risk Management,Requirements of interested parties are considered when identifying information security risks,Not Started
INT-06-04,ISO27001_2022,6.1.1,governance,Actions to address identified risks and opportunities are planned,ISMS planning or risk action plans,strong,Yes,,,Risk Management,Actions to address identified risks and opportunities are planned,Not Started
INT-06-05,ISO27001_2022,6.1.1,governance,Planned actions are integrated into ISMS processes,ISMS procedures or process documentation,weak,Yes,,,Risk Management,Planned actions are integrated into ISMS processes,Not Started
INT-06-06,ISO27001_2022,6.1.2,process,A defined information security risk assessment methodology is established and documented,Risk assessment methodology document,strong,Yes,,,Risk Management,A defined information security risk assessment methodology is established and documented,Not Started
INT-06-07,ISO27001_2022,6.1.2,process,Information security risks are identified for assets within the ISMS scope,Risk register or asset-risk mapping,strong,Yes,,,Risk Management,Information security risks are identified for assets within the ISMS scope,Not Started
INT-06-08,ISO27001_2022,6.1.2,process,Risks are analyzed to determine likelihood and impact using defined criteria,Risk analysis records,strong,Yes,,,Risk Management,Risks are analyzed to determine likelihood and impact using defined criteria,Not Started
INT-06-09,ISO27001_2022,6.1.2,process,Risk acceptance criteria are defined and applied,Risk acceptance criteria documentation,medium,Yes,,,Risk Management,Risk acceptance criteria are defined and applied,Not Started
INT-06-10,ISO27001_2022,6.1.2,process,Risk assessment results are documented and maintained,Risk assessment reports,strong,Yes,,,Risk Management,Risk assessment results are documented and maintained,Not Started
INT-06-11,ISO27001_2022,6.1.2,process,Risk assessments are performed at planned intervals or upon significant changes,Risk review schedule or updated assessments,medium,Yes,,,Risk Management,Risk assessments are performed at planned intervals or upon significant changes,Not Started
INT-06-12,ISO27001_2022,6.1.3,process,Information security risk treatment options are selected based on risk assessment results,Risk treatment plan,strong,Yes,,,Risk Management,Information security risk treatment options are selected based on risk assessment results,Not Started
INT-06-13,ISO27001_2022,6.1.3,process,Appropriate information security controls are selected to treat identified risks,Statement of Applicability,strong,Yes,,,Risk Management,Appropriate information security controls are selected to treat identified risks,Not Started
INT-06-14,ISO27001_2022,6.1.3,process,Risk owners are assigned responsibility for implementing risk treatment actions,Risk register with assigned owners,medium,Yes,,,Risk Management,Risk owners are assigned responsibility for implementing risk treatment actions,Not Started
INT-06-15,ISO27001_2022,6.1.3,process,Risk treatment actions are documented and tracked to completion,Risk treatment tracking records,strong,Yes,,,Risk Management,Risk treatment actions are documented and tracked to completion,Not Started
INT-06-16,ISO27001_2022,6.1.3,process,Residual risks are evaluated and formally accepted by management,Risk acceptance records or approvals,medium,Yes,,,Risk Management,Residual risks are evaluated and formally accepted by management,Not Started
INT-06-17,ISO27001_2022,6.2,governance,Information security objectives are established and documented,Information security objectives document,strong,Yes,,,Risk Management,Define Employment Security Terms,Not Started
INT-06-18,ISO27001_2022,6.2,governance,Information security objectives are consistent with the information security policy,Policy and objectives alignment records,medium,Yes,,,Risk Management,Define Employment Security Terms,Not Started
INT-06-19,ISO27001_2022,6.2,governance,Information security objectives are measurable where practicable,Defined metrics or KPIs,medium,Yes,,,Risk Management,Define Employment Security Terms,Not Started
INT-06-20,ISO27001_2022,6.2,governance,Plans are defined to achieve information security objectives,Objectives action plans,strong,Yes,,,Risk Management,Define Employment Security Terms,Not Started
INT-06-21,ISO27001_2022,6.2,governance,Progress toward information security objectives is monitored and reviewed,Objective tracking or management review records,medium,Yes,,,Risk Management,Define Employment Security Terms,Not Started
INT-07-01,ISO27001_2022,7.1,governance,Resources necessary for the establishment and operation of the ISMS are identified,Resource planning or ISMS resourcing documentation,strong,Yes,,,Governance & Policy,Secure Physical Perimeters,Not Started
INT-07-02,ISO27001_2022,7.1,governance,Adequate personnel are assigned to perform ISMS-related activities,Role assignments or staffing records,medium,Yes,,,Governance & Policy,Secure Physical Perimeters,Not Started
INT-07-03,ISO27001_2022,7.1,governance,Appropriate tools and technologies are provided to support information security activities,Security tooling inventory or licenses,medium,Yes,,,Governance & Policy,Secure Physical Perimeters,Not Started
INT-07-04,ISO27001_2022,7.1,governance,Resources for maintaining and improving the ISMS are reviewed and adjusted as needed,Management review or planning records,weak,Yes,,,Governance & Policy,Secure Physical Perimeters,Not Started
INT-07-05,ISO27001_2022,7.2,governance,Competence requirements for information security roles are defined,Role descriptions or competency requirements,strong,Yes,,,Governance & Policy,Secure Physical Entry,Not Started
INT-07-06,ISO27001_2022,7.2,governance,"Personnel performing information security roles are competent based on education,  training  or experience", Training records or resumes,medium,Yes,,,Governance & Policy,Secure Physical Entry,Not Started
INT-07-07,ISO27001_2022,7.2,governance,Training or other actions are taken to address identified competence gaps,Training plans or improvement actions,medium,Yes,,,Governance & Policy,Secure Physical Entry,Not Started
INT-07-08,ISO27001_2022,7.2,governance,The effectiveness of actions taken to achieve competence is evaluated,Training effectiveness assessments or reviews,weak,Yes,,,Governance & Policy,Secure Physical Entry,Not Started
INT-07-09,ISO27001_2022,7.2,governance,Documented information is retained as evidence of competence,Training records or certification records,strong,Yes,,,Governance & Policy,Secure Physical Entry,Not Started
INT-07-10,ISO27001_2022,7.3,governance,Personnel are aware of the information security policy,Security awareness training or policy acknowledgements,strong,Yes,,,Governance & Policy,Secure Offices and Facilities,Not Started
INT-07-11,ISO27001_2022,7.3,governance,Personnel are aware of their information security responsibilities,Role-based awareness materials or training,medium,Yes,,,Governance & Policy,Secure Offices and Facilities,Not Started
INT-07-12,ISO27001_2022,7.3,governance,Personnel are aware of the consequences of not complying with information security requirements,Disciplinary policy or awareness materials,weak,Yes,,,Governance & Policy,Secure Offices and Facilities,Not Started
INT-07-13,ISO27001_2022,7.3,governance,Information security awareness activities are conducted at planned intervals,Awareness program schedule or records,medium,Yes,,,Governance & Policy,Secure Offices and Facilities,Not Started
INT-07-14,ISO27001_2022,7.4,governance,Information security communication requirements are identified,Communication plan or ISMS communication procedure,strong,Yes,,,Governance & Policy,Monitor Physical Security,Not Started
INT-07-15,ISO27001_2022,7.4,governance,"The organization determines what ,  when,  and with whom to communicate information security matters",Defined communication channels or matrices,medium,Yes,,,Governance & Policy,Monitor Physical Security,Not Started
INT-07-16,ISO27001_2022,7.4,governance,Information security communications are performed as planned,Communication records or evidence of execution,medium,Yes,,,Governance & Policy,Monitor Physical Security,Not Started
INT-07-17,ISO27001_2022,7.4,governance,External communication related to information security is controlled and authorized,External communication procedures or approvals,weak,Yes,,,Governance & Policy,Monitor Physical Security,Not Started
INT-07-18,ISO27001_2022,7.5.1,governance,Documented information required by the ISMS is identified and maintained,ISMS document register,strong,Yes,,,Governance & Policy,Documented information required by the ISMS is identified and maintained,Not Started
INT-07-19,ISO27001_2022,7.5.1,governance,Documented information necessary for effective ISMS operation is available,Approved ISMS documents,strong,Yes,,,Governance & Policy,Documented information necessary for effective ISMS operation is available,Not Started
INT-07-20,ISO27001_2022,7.5.2,governance,"Documented information is appropriately identified including title,  date,  and author",Document templates or metadata,medium,Yes,,,Governance & Policy,"Documented information is appropriately identified including title,  date,  and author",Not Started
INT-07-21,ISO27001_2022,7.5.2,governance,Documented information is reviewed and approved for suitability and adequacy prior to issue,Approval records,strong,Yes,,,Governance & Policy,Documented information is reviewed and approved for suitability and adequacy prior to issue,Not Started
INT-07-22,ISO27001_2022,7.5.2,governance,Changes to documented information are reviewed and approved,Change history or version control,strong,Yes,,,Governance & Policy,Changes to documented information are reviewed and approved,Not Started
INT-07-23,ISO27001_2022,7.5.3,governance,Documented information is controlled to ensure availability and suitability,Access controls or document repositories,strong,Yes,,,Governance & Policy,Documented information is controlled to ensure availability and suitability,Not Started
INT-07-24,ISO27001_2022,7.5.3,governance,Documented information is protected from loss of confidentiality or integrity,Backup and access protection mechanisms,medium,Yes,,,Governance & Policy,Documented information is protected from loss of confidentiality or integrity,Not Started
INT-07-25,ISO27001_2022,7.5.3,governance,Distribution and access to documented information are controlled,Access permission records,medium,Yes,,,Governance & Policy,Distribution and access to documented information are controlled,Not Started
INT-07-26,ISO27001_2022,7.5.3,governance,Retention and disposition of documented information are defined and applied,Retention schedules or disposal records,weak,Yes,,,Governance & Policy,Retention and disposition of documented information are defined and applied,Not Started
INT-08-01,ISO27001_2022,8.1,process,ISMS operational processes are planned and implemented in accordance with defined requirements,ISMS procedures or operational plans,strong,Yes,,,Operations (General),Secure User Endpoints,Not Started
INT-08-02,ISO27001_2022,8.1,process,Operational controls are implemented to meet information security requirements,Operational control evidence or system configurations,strong,Yes,,,Operations (General),Secure User Endpoints,Not Started
INT-08-03,ISO27001_2022,8.1,process,Changes to ISMS operations are planned and controlled,Change management records,medium,Yes,,,Operations (General),Secure User Endpoints,Not Started
INT-08-04,ISO27001_2022,8.1,process,Outsourced ISMS processes are controlled in accordance with ISMS requirements,Supplier agreements or oversight records,medium,Yes,,,Operations (General),Secure User Endpoints,Not Started
INT-08-05,ISO27001_2022,8.2,process,Information security risk assessments are performed according to the defined methodology,Completed risk assessment records,strong,Yes,,,Operations (General),Restrict Privileged Access,Not Started
INT-08-06,ISO27001_2022,8.2,process,Risk assessments are conducted when significant changes occur,Change-triggered risk assessments,medium,Yes,,,Operations (General),Restrict Privileged Access,Not Started
INT-08-07,ISO27001_2022,8.2,process,Risk assessment results are reviewed and validated,Review or approval records,medium,Yes,,,Operations (General),Restrict Privileged Access,Not Started
INT-08-08,ISO27001_2022,8.3,process,Information security risk treatment plans are implemented as planned,Implemented risk treatment actions,strong,Yes,,,Operations (General),Restrict Information Access,Not Started
INT-08-09,ISO27001_2022,8.3,process,Risk treatment actions are monitored for effectiveness,Control effectiveness reviews or metrics,medium,Yes,,,Operations (General),Restrict Information Access,Not Started
INT-08-10,ISO27001_2022,8.3,process,Changes to risk treatment are managed and documented,Updated risk treatment plans or records,weak,Yes,,,Operations (General),Restrict Information Access,Not Started
INT-09-01,ISO27001_2022,9.1,governance,Information security performance metrics are defined,Defined ISMS metrics or KPIs,strong,Yes,,,Internal Audit,Information security performance metrics are defined,Not Started
INT-09-02,ISO27001_2022,9.1,governance,Monitoring and measurement of information security performance are performed,Monitoring records or dashboards,strong,Yes,,,Internal Audit,Monitoring and measurement of information security performance are performed,Not Started
INT-09-03,ISO27001_2022,9.1,governance,Results of monitoring and measurement are analyzed and evaluated,Analysis reports or management review inputs,medium,Yes,,,Internal Audit,Results of monitoring and measurement are analyzed and evaluated,Not Started
