Intent_id,Standard,Clause_or_control,Intent_type,Intent_statement,Evidence_examples,Strength,Mandatory,Applicability ,Exclusion_Justified,Process,Action_Title,compliance_status
INT-A5-91,ISO27001_2022,A.5.16,operational,Identity termination or de-registration processes are implemented,IAM offboarding records,medium,NO,,,Governance & Policy,Manage Identity Lifecycle,Not Started
INT-A5-92,ISO27001_2022,A.5.17,governance,A documented process exists for distributing initial authentication information,Authentication procedures,medium,NO,,,Governance & Policy,Secure Authentication Information,Not Started
INT-A5-93,ISO27001_2022,A.5.17,governance,User identity is verified before issuing or resetting authentication information,Authentication procedures,medium,NO,,,Governance & Policy,Secure Authentication Information,Not Started
INT-A5-94,ISO27001_2022,A.5.17,governance,A password or authentication policy defining minimum security requirements exists,Authentication or password policy,medium,NO,,,Governance & Policy,Secure Authentication Information,Not Started
INT-A5-95,ISO27001_2022,A.5.17,technical,Password complexity requirements are enforced,System configuration,strong,NO,,,Governance & Policy,Secure Authentication Information,Not Started
INT-A5-96,ISO27001_2022,A.5.17,technical,Password history requirements are enforced,System configuration,strong,NO,,,Governance & Policy,Secure Authentication Information,Not Started
INT-A5-97,ISO27001_2022,A.5.17,technical,Maximum password age requirements are enforced,System configuration,strong,NO,,,Governance & Policy,Secure Authentication Information,Not Started
INT-A5-98,ISO27001_2022,A.5.17,technical,Account lockout controls are enforced after failed authentication attempts,System configuration,strong,NO,,,Governance & Policy,Secure Authentication Information,Not Started
INT-A5-99,ISO27001_2022,A.5.17,governance,Authentication documentation has been reviewed within defined timeframes,Version history or review records,medium,NO,,,Governance & Policy,Secure Authentication Information,Not Started
INT-A5-100,ISO27001_2022,A.5.18,governance,A formal process exists to provision and revoke access rights,Access management procedures,medium,NO,,,Governance & Policy,Manage Access Rights,Not Started
INT-A5-101,ISO27001_2022,A.5.18,governance,Access rights are approved by authorized parties before provisioning,Access request records,medium,NO,,,Governance & Policy,Manage Access Rights,Not Started
INT-A5-102,ISO27001_2022,A.5.18,governance,User access rights reviews are conducted at least annually,Access review records,medium,NO,,,Governance & Policy,Manage Access Rights,Not Started
INT-A5-103,ISO27001_2022,A.5.18,governance,Privileged access rights are reviewed at least quarterly,Privileged access review records,medium,NO,,,Governance & Policy,Manage Access Rights,Not Started
INT-A5-104,ISO27001_2022,A.5.18,technical,Access for terminated users is removed or disabled promptly,IAM termination logs,strong,NO,,,Governance & Policy,Manage Access Rights,Not Started
INT-A5-105,ISO27001_2022,A.5.18,technical,Access rights are updated within defined timeframes after personnel transfer,IAM records,strong,NO,,,Governance & Policy,Manage Access Rights,Not Started
INT-A5-106,ISO27001_2022,A.5.18,technical,Inactive user accounts are disabled or removed within defined timeframes,IAM configuration,strong,NO,,,Governance & Policy,Manage Access Rights,Not Started
INT-A5-107,ISO27001_2022,A.5.18,technical,Temporary user accounts are disabled after a predefined period,IAM configuration,strong,NO,,,Governance & Policy,Manage Access Rights,Not Started
INT-A5-108,ISO27001_2022,A.5.18,technical,Third-party remote access is enabled only when required and disabled afterward,Remote access configuration,strong,NO,,,Governance & Policy,Manage Access Rights,Not Started
INT-A5-109,ISO27001_2022,A.5.19,governance,A documented process exists to manage information security risks related to suppliers,Third-party risk policy or procedures,medium,NO,,,Governance & Policy,Manage Supplier Security Risks,Not Started
INT-A5-110,ISO27001_2022,A.5.19,governance,Issue management and remediation tracking for supplier security risks is defined,Third-party issue logs or procedures,medium,NO,,,Governance & Policy,Manage Supplier Security Risks,Not Started
INT-A5-111,ISO27001_2022,A.5.19,governance,Suppliers are assessed for criticality as part of initial and periodic risk assessments,Supplier risk assessments,medium,NO,,,Governance & Policy,Manage Supplier Security Risks,Not Started
INT-A5-112,ISO27001_2022,A.5.19,governance,Security due diligence or assessments are performed for suppliers,Due diligence records or assessments,medium,NO,,,Governance & Policy,Manage Supplier Security Risks,Not Started
INT-A5-113,ISO27001_2022,A.5.19,governance,A defined frequency exists to review and update supplier security risk documentation,Supplier risk procedures,medium,NO,,,Governance & Policy,Manage Supplier Security Risks,Not Started
INT-A5-114,ISO27001_2022,A.5.19,governance,Supplier security risk processes have been reviewed within defined timeframes,Version history or review records,medium,NO,,,Governance & Policy,Manage Supplier Security Risks,Not Started
INT-A5-115,ISO27001_2022,A.5.19,governance,Supplier security risk management requirements are communicated to relevant personnel,Training records or communications,medium,NO,,,Governance & Policy,Manage Supplier Security Risks,Not Started
INT-A5-116,ISO27001_2022,A.5.20,governance,Information security requirements are defined for suppliers based on relationship type,Contract templates or security requirements,medium,NO,,,Governance & Policy,Manage Supplier Agreements,Not Started
INT-A5-117,ISO27001_2022,A.5.20,governance,Suppliers formally agree to applicable information security requirements,Executed supplier agreements,medium,NO,,,Governance & Policy,Manage Supplier Agreements,Not Started
INT-A5-118,ISO27001_2022,A.5.20,governance,Standard contract templates including security clauses are used with suppliers,Contract templates,medium,NO,,,Governance & Policy,Manage Supplier Agreements,Not Started
INT-A5-119,ISO27001_2022,A.5.21,governance,A process exists to manage information security risks in the ICT supply chain,ICT supply chain security procedures,medium,NO,,,Governance & Policy,Secure ICT Supply Chain,Not Started
INT-A5-120,ISO27001_2022,A.5.21,governance,ICT supplier agreements include information security requirements,Supplier agreements,medium,NO,,,Governance & Policy,Secure ICT Supply Chain,Not Started
INT-A5-121,ISO27001_2022,A.5.21,governance,Risk assessments or monitoring are performed for critical ICT suppliers,Supplier risk or monitoring reports,medium,NO,,,Governance & Policy,Secure ICT Supply Chain,Not Started
INT-A5-122,ISO27001_2022,A.5.22,governance,A list of suppliers and services provided is maintained,Supplier register,medium,NO,,,Governance & Policy,Monitor Supplier Services,Not Started
INT-A5-123,ISO27001_2022,A.5.22,governance,Processes and responsibilities are defined to manage changes to supplier services,Supplier management procedures,medium,NO,,,Governance & Policy,Monitor Supplier Services,Not Started
INT-A5-124,ISO27001_2022,A.5.22,governance,Supplier performance is monitored against contractual requirements or SLAs,Performance reviews or SLA reports,medium,NO,,,Governance & Policy,Monitor Supplier Services,Not Started
INT-A5-125,ISO27001_2022,A.5.22,governance,Procedures exist to handle breaches of supplier contractual or security obligations,Breach or incident handling procedures,medium,NO,,,Governance & Policy,Monitor Supplier Services,Not Started
INT-A5-126,ISO27001_2022,A.5.22,governance,A register of detected supplier-related breaches is maintained,Breach register,medium,NO,,,Governance & Policy,Monitor Supplier Services,Not Started
INT-A5-127,ISO27001_2022,A.5.23,governance,Processes exist to manage information security risks related to cloud services,Cloud security policy or guidelines,medium,NO,,,Governance & Policy,Manage Cloud Services Security,Not Started
INT-A5-128,ISO27001_2022,A.5.23,governance,Security requirements for cloud services are defined and documented,Cloud security standards or policies,medium,NO,,,Governance & Policy,Manage Cloud Services Security,Not Started
INT-A5-129,ISO27001_2022,A.5.23,governance,Security evaluations are performed for cloud service providers,Vendor assessments or SOC reports,medium,NO,,,Governance & Policy,Manage Cloud Services Security,Not Started
INT-A5-130,ISO27001_2022,A.5.23,governance,Shared responsibility models or equivalent agreements are reviewed and understood,Cloud provider agreements or SOC reports,medium,NO,,,Governance & Policy,Manage Cloud Services Security,Not Started
INT-A5-131,ISO27001_2022,A.5.23,governance,Changes to cloud services are identified and assessed for security impact,Change notifications or risk reviews,medium,NO,,,Governance & Policy,Manage Cloud Services Security,Not Started
INT-A5-132,ISO27001_2022,A.5.24,governance,An incident management policy procedure and incident response plan exist,Incident management policy or IRP,medium,NO,,,Governance & Policy,Plan for Incident Management,Not Started
INT-A5-133,ISO27001_2022,A.5.24,governance,Incident definitions are documented across relevant domains,Incident management policy,medium,NO,,,Governance & Policy,Plan for Incident Management,Not Started
INT-A5-134,ISO27001_2022,A.5.24,governance,Incident management scope includes employees and subcontractors,Incident management policy,medium,NO,,,Governance & Policy,Plan for Incident Management,Not Started
INT-A5-135,ISO27001_2022,A.5.24,governance,Procedures exist to prevent and detect information security incidents,IR or monitoring procedures,medium,NO,,,Governance & Policy,Plan for Incident Management,Not Started
INT-A5-136,ISO27001_2022,A.5.24,governance,Procedures exist to investigate information security incidents,Incident response procedures,medium,NO,,,Governance & Policy,Plan for Incident Management,Not Started
INT-A5-137,ISO27001_2022,A.5.24,governance,Procedures exist to remediate incidents and track them to closure,Incident management workflows or tickets,medium,NO,,,Governance & Policy,Plan for Incident Management,Not Started
INT-A5-138,ISO27001_2022,A.5.24,governance,Internal and external incident reporting requirements and timelines are defined,IRP or notification procedures,medium,NO,,,Governance & Policy,Plan for Incident Management,Not Started
INT-A5-139,ISO27001_2022,A.5.24,governance,A defined frequency exists to review and update incident documentation,Incident management policy,medium,NO,,,Governance & Policy,Plan for Incident Management,Not Started
INT-A5-140,ISO27001_2022,A.5.24,governance,Incident documentation has been reviewed within defined timeframes,Version history or review records,medium,NO,,,Governance & Policy,Plan for Incident Management,Not Started
INT-A5-141,ISO27001_2022,A.5.24,governance,Incident reporting procedures are communicated and trained to personnel,Awareness or training records,medium,NO,,,Governance & Policy,Plan for Incident Management,Not Started
INT-A5-142,ISO27001_2022,A.5.25,operations,Procedures exist to triage assess and classify information security events,Event triage or classification procedures,medium,NO,,,Governance & Policy,Assess and Classify Security Events,Not Started
INT-A5-143,ISO27001_2022,A.5.25,operations,Designated personnel are available to respond to security alerts within defined timeframes,On-call roster or SOC procedures,medium,NO,,,Governance & Policy,Assess and Classify Security Events,Not Started
INT-A5-144,ISO27001_2022,A.5.25,operations,Security events are assessed and categorized as incidents when applicable,Classification logs or ticketing system,medium,NO,,,Governance & Policy,Assess and Classify Security Events,Not Started
INT-A5-145,ISO27001_2022,A.5.26,operations,An incident response plan is established and maintained,Incident response plan,medium,NO,,,Governance & Policy,Respond to Security Incidents,Not Started
INT-A5-146,ISO27001_2022,A.5.26,operations,Incident response roles responsibilities and communication contacts are defined,IRP or call tree,medium,NO,,,Governance & Policy,Respond to Security Incidents,Not Started
INT-A5-147,ISO27001_2022,A.5.26,operations,Documented response procedures exist for different incident categories,IR playbooks or procedures,medium,NO,,,Governance & Policy,Respond to Security Incidents,Not Started
INT-A5-148,ISO27001_2022,A.5.26,operations,Post incident review or postmortem activities are defined and required,IRP or PIR procedure,medium,NO,,,Governance & Policy,Respond to Security Incidents,Not Started
INT-A5-149,ISO27001_2022,A.5.26,operations,Incident response procedures are communicated and personnel are trained,Training or tabletop attendance records,medium,NO,,,Governance & Policy,Respond to Security Incidents,Not Started
INT-A5-150,ISO27001_2022,A.5.26,operations,Information security incidents are handled in accordance with documented procedures,Incident records or tickets,medium,NO,,,Governance & Policy,Respond to Security Incidents,Not Started
INT-A5-151,ISO27001_2022,A.5.26,operations,Incident response plans are tested at planned intervals,Tabletop or exercise results,medium,NO,,,Governance & Policy,Respond to Security Incidents,Not Started
INT-A5-152,ISO27001_2022,A.5.27,operations,Postmortems are conducted for high or medium severity incidents,PIR or lessons learned reports,medium,NO,,,Governance & Policy,Learn from Information Security Incidents,Not Started
INT-A5-153,ISO27001_2022,A.5.27,operations,Lessons learned are tracked and used to implement corrective actions,Corrective action or backlog records,medium,NO,,,Governance & Policy,Learn from Information Security Incidents,Not Started
INT-A5-154,ISO27001_2022,A.5.27,operations,Lessons learned from incidents are communicated to relevant stakeholders,Communications or briefings,medium,NO,,,Governance & Policy,Learn from Information Security Incidents,Not Started
INT-A5-155,ISO27001_2022,A.5.28,operations,Forensic and evidence collection guidance exists for information security incidents,Forensic or evidence procedures,medium,NO,,,Governance & Policy,Collect and Preserve Evidence,Not Started
INT-A5-156,ISO27001_2022,A.5.28,operations,Procedures exist for identifying collecting preserving and acquiring evidence,Evidence handling procedures,medium,NO,,,Governance & Policy,Collect and Preserve Evidence,Not Started
INT-A5-157,ISO27001_2022,A.5.28,operations,Chain of custody documentation is maintained for collected evidence,Chain of custody forms or case logs,medium,NO,,,Governance & Policy,Collect and Preserve Evidence,Not Started
INT-A5-158,ISO27001_2022,A.5.28,operations,Defined frequency exists to review and update evidence collection documentation,Evidence procedures,medium,NO,,,Governance & Policy,Collect and Preserve Evidence,Not Started
INT-A5-159,ISO27001_2022,A.5.28,operations,Evidence collection procedures are communicated to relevant personnel,Training or communications records,medium,NO,,,Governance & Policy,Collect and Preserve Evidence,Not Started
INT-A5-160,ISO27001_2022,A.5.29,resilience,Business continuity and disaster recovery policies exist and include information security expectations,BCP or DR policy,medium,NO,,,Governance & Policy,Plan for Business Continuity,Not Started
INT-A5-161,ISO27001_2022,A.5.29,resilience,BCP and DR scope covers relevant products and services,BCP or DR policy,medium,NO,,,Governance & Policy,Plan for Business Continuity,Not Started
INT-A5-162,ISO27001_2022,A.5.29,resilience,BCP and DR policies are reviewed at planned intervals,Review records or version history,medium,NO,,,Governance & Policy,Plan for Business Continuity,Not Started
INT-A5-163,ISO27001_2022,A.5.29,resilience,BCP and DR requirements are communicated to relevant personnel,Training or communications records,medium,NO,,,Governance & Policy,Plan for Business Continuity,Not Started
INT-A5-164,ISO27001_2022,A.5.29,resilience,Business impact analysis is performed for critical services at planned intervals,BIA reports,medium,NO,,,Governance & Policy,Plan for Business Continuity,Not Started
INT-A5-165,ISO27001_2022,A.5.29,resilience,A documented business continuity plan exists,BCP documentation,medium,NO,,,Governance & Policy,Plan for Business Continuity,Not Started
INT-A5-166,ISO27001_2022,A.5.29,resilience,Business continuity plans are reviewed and updated at planned intervals,Review records,medium,NO,,,Governance & Policy,Plan for Business Continuity,Not Started
INT-A5-167,ISO27001_2022,A.5.29,resilience,Business continuity plans are tested at planned intervals,Test or exercise reports,medium,NO,,,Governance & Policy,Plan for Business Continuity,Not Started
INT-A5-168,ISO27001_2022,A.5.29,resilience,A documented disaster recovery plan exists,DRP documentation,medium,NO,,,Governance & Policy,Plan for Business Continuity,Not Started
INT-A5-169,ISO27001_2022,A.5.29,resilience,Disaster recovery plans are reviewed and updated at planned intervals,Review records,medium,NO,,,Governance & Policy,Plan for Business Continuity,Not Started
INT-A5-170,ISO27001_2022,A.5.29,resilience,End to end disaster recovery exercises are performed for critical technology components,DR exercise results,medium,NO,,,Governance & Policy,Plan for Business Continuity,Not Started
INT-A5-171,ISO27001_2022,A.5.29,resilience,Procedures exist for data restoration in accordance with defined schedules,Backup or restore procedures,strong,NO,,,Governance & Policy,Plan for Business Continuity,Not Started
INT-A5-172,ISO27001_2022,A.5.29,resilience,RTOs and RPOs are defined for critical services,BIA or continuity plans,medium,NO,,,Governance & Policy,Plan for Business Continuity,Not Started
INT-A5-173,ISO27001_2022,A.5.29,resilience,Significant BCP or DR changes are communicated to stakeholders,Change communications or notices,medium,NO,,,Governance & Policy,Plan for Business Continuity,Not Started
INT-A5-174,ISO27001_2022,A.5.29,resilience,Critical issues identified during BC or DR tests are remediated within defined timeframes,Issue trackers or corrective actions,medium,NO,,,Governance & Policy,Plan for Business Continuity,Not Started
INT-A5-175,ISO27001_2022,A.5.30,resilience,ICT continuity and disaster recovery plans exist supporting information security resilience,ICT BCP or DR plans,medium,NO,,,Governance & Policy,Ensure ICT Readiness for Business Continuity,Not Started
INT-A5-176,ISO27001_2022,A.5.30,resilience,ICT continuity plans are tested and documented at planned intervals,ICT test results,medium,NO,,,Governance & Policy,Ensure ICT Readiness for Business Continuity,Not Started
INT-A5-177,ISO27001_2022,A.5.30,resilience,Lessons learned from ICT continuity tests are captured and tracked,After action reports,medium,NO,,,Governance & Policy,Ensure ICT Readiness for Business Continuity,Not Started
INT-A5-178,ISO27001_2022,A.5.31,governance,Legal statutory regulatory and contractual information security requirements are identified and documented,Compliance matrix or register,medium,NO,,,Governance & Policy,Identify Legal and Contractual Requirements,Not Started
INT-A5-179,ISO27001_2022,A.5.31,governance,ISMS controls are mapped to applicable legal and contractual requirements,Compliance matrix,medium,NO,,,Governance & Policy,Identify Legal and Contractual Requirements,Not Started
INT-A5-180,ISO27001_2022,A.5.31,governance,A defined process exists to periodically review and update legal and contractual requirements,Legal review procedure,medium,NO,,,Governance & Policy,Identify Legal and Contractual Requirements,Not Started
INT-A5-181,ISO27001_2022,A.5.32,governance,Procedures exist to protect intellectual property rights related to information assets,IP policy or procedures,medium,NO,,,Governance & Policy,Protect Intellectual Property Rights,Not Started
INT-A5-182,ISO27001_2022,A.5.32,governance,Software installation and usage are tracked to ensure licensing compliance,Software inventory or license records,medium,NO,,,Governance & Policy,Protect Intellectual Property Rights,Not Started
INT-A5-183,ISO27001_2022,A.5.33,governance,Records retention and protection requirements are documented and implemented,Records retention policy or schedule,medium,NO,,,Governance & Policy,Protect Records,Not Started
INT-A5-184,ISO27001_2022,A.5.33,governance,A records retention schedule defining retention periods exists,Retention schedule,medium,NO,,,Governance & Policy,Protect Records,Not Started
INT-A5-185,ISO27001_2022,A.5.33,governance,Records are protected from loss destruction or unauthorized access or release,Access or integrity controls,strong,NO,,,Governance & Policy,Protect Records,Not Started
INT-A5-186,ISO27001_2022,A.5.33,governance,Records management documentation is reviewed at planned intervals,Review records,medium,NO,,,Governance & Policy,Protect Records,Not Started
INT-A5-187,ISO27001_2022,A.5.33,governance,Records management requirements are communicated to relevant personnel,Training or communications,medium,NO,,,Governance & Policy,Protect Records,Not Started
INT-A5-188,ISO27001_2022,A.5.34,privacy,A privacy or data protection policy exists and is maintained,Privacy policy,medium,NO,,,Governance & Policy,Protect Privacy and PII,Not Started
INT-A5-189,ISO27001_2022,A.5.34,privacy,A defined process exists to assess PII and related regulatory requirements,Privacy procedures or DPIA process,medium,NO,,,Governance & Policy,Protect Privacy and PII,Not Started
INT-A5-190,ISO27001_2022,A.5.34,privacy,Requirements exist to protect sensitive personally identifiable information,Privacy or security controls,medium,NO,,,Governance & Policy,Protect Privacy and PII,Not Started
INT-A5-191,ISO27001_2022,A.5.34,privacy,Technical measures for PII collection processing storage and disclosure are documented,Data protection controls documentation,medium,NO,,,Governance & Policy,Protect Privacy and PII,Not Started
INT-A5-192,ISO27001_2022,A.5.34,privacy,PII collection use and retention are limited to the minimum necessary with appropriate consent,Privacy notices or consent records,medium,NO,,,Governance & Policy,Protect Privacy and PII,Not Started
INT-A5-193,ISO27001_2022,A.5.34,privacy,PII holdings are periodically reviewed for authorized purpose and retention,Review logs or DPIA updates,medium,NO,,,Governance & Policy,Protect Privacy and PII,Not Started
INT-A5-194,ISO27001_2022,A.5.34,privacy,A process exists to manage PII disclosure requests and stakeholder communication,Disclosure procedures or request logs,medium,NO,,,Governance & Policy,Protect Privacy and PII,Not Started
INT-A5-195,ISO27001_2022,A.5.34,privacy,A register of third parties receiving PII including purpose and date is maintained,Third party disclosure register,medium,NO,,,Governance & Policy,Protect Privacy and PII,Not Started
INT-A5-196,ISO27001_2022,A.5.34,privacy,Privacy documentation is reviewed at planned intervals,Review records,medium,NO,,,Governance & Policy,Protect Privacy and PII,Not Started
INT-A5-197,ISO27001_2022,A.5.34,privacy,Privacy requirements are communicated to relevant personnel,Training or communications,medium,NO,,,Governance & Policy,Protect Privacy and PII,Not Started
INT-A5-198,ISO27001_2022,A.5.35,assurance,Independent internal or external reviews of information security are performed as planned,Audit reports,medium,NO,,,Governance & Policy,Conduct Independent Security Reviews,Not Started
INT-A5-199,ISO27001_2022,A.5.35,assurance,Review findings are reported tracked and remediation actions are managed,Corrective action plans or issue tracker,medium,NO,,,Governance & Policy,Conduct Independent Security Reviews,Not Started
INT-A5-200,ISO27001_2022,A.5.36,assurance,Processes exist to monitor compliance with information security policies and standards,Compliance monitoring procedures,medium,NO,,,Governance & Policy,Monitor Compliance with Policies,Not Started
INT-A5-201,ISO27001_2022,A.5.36,assurance,Compliance monitoring activities are performed within defined intervals,Checklists or audit results,medium,NO,,,Governance & Policy,Monitor Compliance with Policies,Not Started
INT-A5-202,ISO27001_2022,A.5.36,assurance,Independent security assessments occur at least annually and after major changes,Assessment reports,medium,NO,,,Governance & Policy,Monitor Compliance with Policies,Not Started
INT-A5-203,ISO27001_2022,A.5.36,assurance,Penetration testing is performed at planned intervals and after major changes,Penetration test reports,medium,NO,,,Governance & Policy,Monitor Compliance with Policies,Not Started
INT-A5-204,ISO27001_2022,A.5.36,assurance,Identified findings are remediated and retested to verify closure,Remediation tickets or retest evidence,medium,NO,,,Governance & Policy,Monitor Compliance with Policies,Not Started
INT-A5-205,ISO27001_2022,A.5.36,assurance,Corrective or disciplinary actions are recorded for noncompliance,HR records or CAPA logs,medium,NO,,,Governance & Policy,Monitor Compliance with Policies,Not Started
INT-A5-206,ISO27001_2022,A.5.37,operations,Standard operating procedures for processing facilities are documented and approved,SOP list or approvals,medium,NO,,,Governance & Policy,Document Operating Procedures,Not Started
INT-A5-207,ISO27001_2022,A.5.37,operations,Standard operating procedures are accessible to personnel who require them,Intranet or procedure repository,medium,NO,,,Governance & Policy,Document Operating Procedures,Not Started
INT-A5-208,ISO27001_2022,A.5.37,operations,Standard operating procedures are reviewed and updated at planned intervals,Review records or version history,medium,NO,,,Governance & Policy,Document Operating Procedures,Not Started
INT-A6-01,ISO27001_2022,A.6.1,people,A documented background screening policy or procedure exists for personnel and contractors,Background Screening Policy,medium,NO,,,Governance & Policy,Screen Candidates,Not Started
