Intent_id,Standard,Clause_or_control,Intent_type,Intent_statement,Evidence_examples,Strength,Mandatory,Applicability ,Exclusion_Justified,Process,Action_Title,compliance_status
INT-09-04,ISO27001_2022,9.1,governance,Monitoring and measurement activities are conducted at planned intervals,Measurement schedules or plans,medium,Yes,,,Internal Audit,Monitoring and measurement activities are conducted at planned intervals,Not Started
INT-09-05,ISO27001_2022,9.2.1,governance,An internal audit process for the ISMS is defined and documented,Internal audit procedure,strong,Yes,,,Internal Audit,An internal audit process for the ISMS is defined and documented,Not Started
INT-09-06,ISO27001_2022,9.2.1,governance,Internal audits are conducted at planned intervals,Internal audit reports,strong,Yes,,,Internal Audit,Internal audits are conducted at planned intervals,Not Started
INT-09-07,ISO27001_2022,9.2.1,governance,Internal audits assess conformity with ISO/IEC 27001 requirements,Audit criteria and checklists,medium,Yes,,,Internal Audit,Internal audits assess conformity with ISO/IEC 27001 requirements,Not Started
INT-09-08,ISO27001_2022,9.2.1,governance,Internal auditors are independent of the activities being audited,Auditor assignment or independence records,medium,Yes,,,Internal Audit,Internal auditors are independent of the activities being audited,Not Started
INT-09-09,ISO27001_2022,9.2.2,governance,An internal audit programme is established considering importance of processes,Internal audit programme,strong,Yes,,,Internal Audit,An internal audit programme is established considering importance of processes,Not Started
INT-09-10,ISO27001_2022,9.2.2,governance,The audit programme is updated based on previous audit results and changes,Updated audit programme,medium,Yes,,,Internal Audit,The audit programme is updated based on previous audit results and changes,Not Started
INT-09-11,ISO27001_2022,9.3.1,governance,Top management conducts management reviews of the ISMS at planned intervals,Management review records,strong,Yes,,,Internal Audit,Top management conducts management reviews of the ISMS at planned intervals,Not Started
INT-09-12,ISO27001_2022,9.3.1,governance,Management reviews are conducted according to a defined process,Management review procedure,medium,Yes,,,Internal Audit,Management reviews are conducted according to a defined process,Not Started
INT-09-13,ISO27001_2022,9.3.2,governance,Management reviews consider the status of actions from previous reviews,Action tracking records,medium,Yes,,,Internal Audit,Management reviews consider the status of actions from previous reviews,Not Started
INT-09-14,ISO27001_2022,9.3.2,governance,Management reviews consider changes affecting the ISMS,Review inputs or agendas,medium,Yes,,,Internal Audit,Management reviews consider changes affecting the ISMS,Not Started
INT-09-15,ISO27001_2022,9.3.2,governance,Management reviews consider ISMS performance and effectiveness,Performance reports,strong,Yes,,,Internal Audit,Management reviews consider ISMS performance and effectiveness,Not Started
INT-09-16,ISO27001_2022,9.3.3,governance,Outputs of management reviews include decisions related to ISMS improvement,Management review outputs,strong,Yes,,,Internal Audit,Outputs of management reviews include decisions related to ISMS improvement,Not Started
INT-09-17,ISO27001_2022,9.3.3,governance,Outputs include decisions on resource needs and changes to the ISMS,Documented decisions or action plans,medium,Yes,,,Internal Audit,Outputs include decisions on resource needs and changes to the ISMS,Not Started
INT-10-01,ISO27001_2022,10.1,process,Nonconformities related to the ISMS are identified and documented,Nonconformity or incident records,strong,Yes,,,Improvement,Nonconformities related to the ISMS are identified and documented,Not Started
INT-10-02,ISO27001_2022,10.1,process,Actions are taken to control and correct identified nonconformities,Corrective action records,strong,Yes,,,Improvement,Actions are taken to control and correct identified nonconformities,Not Started
INT-10-03,ISO27001_2022,10.1,process,Root causes of nonconformities are evaluated,Root cause analysis records,medium,Yes,,,Improvement,Root causes of nonconformities are evaluated,Not Started
INT-10-04,ISO27001_2022,10.1,process,Corrective actions are implemented to prevent recurrence,Corrective action plans,strong,Yes,,,Improvement,Corrective actions are implemented to prevent recurrence,Not Started
INT-10-05,ISO27001_2022,10.1,process,Effectiveness of corrective actions is reviewed,Corrective action effectiveness reviews,medium,Yes,,,Improvement,Effectiveness of corrective actions is reviewed,Not Started
INT-10-06,ISO27001_2022,10.2,governance,The organization identifies opportunities for continual improvement of the ISMS,Improvement logs or management review actions,medium,Yes,,,Improvement,The organization identifies opportunities for continual improvement of the ISMS,Not Started
INT-10-07,ISO27001_2022,10.2,governance,Improvements to the ISMS are planned and implemented,Improvement plans or change records,strong,Yes,,,Improvement,Improvements to the ISMS are planned and implemented,Not Started
INT-10-08,ISO27001_2022,10.2,governance,The effectiveness of ISMS improvements is evaluated,Post-implementation review records,medium,Yes,,,Improvement,The effectiveness of ISMS improvements is evaluated,Not Started
INT-A5-01,ISO27001_2022,A.5.1,governance,A documented set of information security policies exists,Information security policy suite,medium,YES,,,Governance & Policy,Establish Information Security Policies,Not Started
INT-A5-02,ISO27001_2022,A.5.1,governance,Topic-specific information security policies are defined for applicable control areas,Set of topic-specific security policies,medium,NO,,,Governance & Policy,Establish Information Security Policies,Not Started
INT-A5-03,ISO27001_2022,A.5.1,governance,Information security policies are formally approved by top management,Policy approval records or sign-off,medium,NO,,,Governance & Policy,Establish Information Security Policies,Not Started
INT-A5-04,ISO27001_2022,A.5.1,governance,Information security policies are published and accessible to relevant personnel,Intranet or policy repository,medium,NO,,,Governance & Policy,Establish Information Security Policies,Not Started
INT-A5-05,ISO27001_2022,A.5.1,governance,Information security policies are communicated to relevant personnel and interested parties,Emails or training records,medium,NO,,,Governance & Policy,Establish Information Security Policies,Not Started
INT-A5-06,ISO27001_2022,A.5.1,governance,Each information security policy defines a review and update frequency,Policy documents,medium,NO,,,Governance & Policy,Establish Information Security Policies,Not Started
INT-A5-07,ISO27001_2022,A.5.1,governance,Information security policies are reviewed within defined review periods,Version history or review records,medium,NO,,,Governance & Policy,Establish Information Security Policies,Not Started
INT-A5-08,ISO27001_2022,A.5.1,governance,Relevant personnel acknowledge information security policies,Signed acknowledgements or LMS records,weak,NO,,,Governance & Policy,Establish Information Security Policies,Not Started
INT-A5-09,ISO27001_2022,A.5.2,governance,Information security roles and responsibilities are formally defined and documented,Security governance policy,medium,NO,,,Governance & Policy,Assign Security Roles & Responsibilities,Not Started
INT-A5-10,ISO27001_2022,A.5.2,governance,Information security roles and responsibilities are allocated according to organizational needs,Responsibility matrix or role assignments,medium,NO,,,Governance & Policy,Assign Security Roles & Responsibilities,Not Started
INT-A5-11,ISO27001_2022,A.5.2,governance,Information security roles and responsibilities cover employees contractors and third parties,Role definitions or governance policy,medium,NO,,,Governance & Policy,Assign Security Roles & Responsibilities,Not Started
INT-A5-12,ISO27001_2022,A.5.2,governance,A defined frequency exists to review and update information security roles and responsibilities,Governance policy or review schedule,medium,NO,,,Governance & Policy,Assign Security Roles & Responsibilities,Not Started
INT-A5-13,ISO27001_2022,A.5.2,governance,Information security roles and responsibilities are reviewed within defined timeframes,Version history or review records,medium,NO,,,Governance & Policy,Assign Security Roles & Responsibilities,Not Started
INT-A5-14,ISO27001_2022,A.5.2,governance,Information security roles and responsibilities are communicated to relevant personnel,Training or awareness records,medium,NO,,,Governance & Policy,Assign Security Roles & Responsibilities,Not Started
INT-A5-15,ISO27001_2022,A.5.2,governance,Reporting lines and accountability for information security activities are clearly defined,Organizational chart or RACI matrix,medium,NO,,,Governance & Policy,Assign Security Roles & Responsibilities,Not Started
INT-A5-16,ISO27001_2022,A.5.3,governance,Segregation of conflicting duties and areas of responsibility is formally defined,Security governance policy,medium,NO,,,Governance & Policy,Segregate Conflicting Duties,Not Started
INT-A5-17,ISO27001_2022,A.5.3,governance,Segregation of duties requirements are communicated to relevant personnel,Training or awareness records,medium,NO,,,Governance & Policy,Segregate Conflicting Duties,Not Started
INT-A5-18,ISO27001_2022,A.5.3,governance,A defined frequency exists to review and update segregation of duties documentation,Governance policy or review schedule,medium,NO,,,Governance & Policy,Segregate Conflicting Duties,Not Started
INT-A5-19,ISO27001_2022,A.5.3,governance,Segregation of duties documentation has been reviewed within defined review periods,Version history or review records,medium,NO,,,Governance & Policy,Segregate Conflicting Duties,Not Started
INT-A5-20,ISO27001_2022,A.5.3,technical,Separation of duties is enforced between requester approver and implementer for change requests,Change management workflow or access control matrix,strong,NO,,,Governance & Policy,Segregate Conflicting Duties,Not Started
INT-A5-21,ISO27001_2022,A.5.3,technical,Separation of duties is enforced between development test and production environments,Access control configuration or role assignments,strong,NO,,,Governance & Policy,Segregate Conflicting Duties,Not Started
INT-A5-22,ISO27001_2022,A.5.3,technical,Technical or procedural controls are implemented to enforce segregation of duties,System permissions or workflow approvals,strong,NO,,,Governance & Policy,Segregate Conflicting Duties,Not Started
INT-A5-23,ISO27001_2022,A.5.4,governance,Management requires employees and contractors to comply with information security policies and procedures,Security governance policy,medium,NO,,,Governance & Policy,Enforce Management Responsibilities,Not Started
INT-A5-24,ISO27001_2022,A.5.4,governance,Information security requirements are communicated to relevant personnel,Training or awareness materials,medium,NO,,,Governance & Policy,Enforce Management Responsibilities,Not Started
INT-A5-25,ISO27001_2022,A.5.4,governance,A defined frequency exists to review management responsibility documentation,Governance policy or review schedule,medium,NO,,,Governance & Policy,Enforce Management Responsibilities,Not Started
INT-A5-26,ISO27001_2022,A.5.4,governance,Management responsibility documentation has been reviewed within defined timeframes,Version history or review records,medium,NO,,,Governance & Policy,Enforce Management Responsibilities,Not Started
INT-A5-27,ISO27001_2022,A.5.4,governance,Top management and process owners actively oversee information security processes,Oversight meeting minutes or status reports,medium,NO,,,Governance & Policy,Enforce Management Responsibilities,Not Started
INT-A5-28,ISO27001_2022,A.5.4,governance,Management intervention is evidenced when addressing security issues or enforcing ISMS controls,Incident or corrective action records,medium,NO,,,Governance & Policy,Enforce Management Responsibilities,Not Started
INT-A5-29,ISO27001_2022,A.5.5,governance,Responsibilities are defined for maintaining contact with relevant authorities,Incident response or governance procedures,medium,NO,,,Governance & Policy,Maintain Contact with Authorities,Not Started
INT-A5-30,ISO27001_2022,A.5.5,governance,Procedures exist for establishing and maintaining communication with relevant authorities,Documented procedures,medium,NO,,,Governance & Policy,Maintain Contact with Authorities,Not Started
INT-A5-31,ISO27001_2022,A.5.5,governance,Records of communication with authorities are maintained where applicable,Communication records or incident logs,medium,NO,,,Governance & Policy,Maintain Contact with Authorities,Not Started
INT-A5-32,ISO27001_2022,A.5.6,governance,Responsibilities are defined to maintain contact with special interest groups or security forums,Governance or responsibility documentation,medium,NO,,,Governance & Policy,Maintain Contact with Interest Groups,Not Started
INT-A5-33,ISO27001_2022,A.5.6,governance,The organization maintains membership or participation in relevant security groups or forums,Membership records or participation evidence,medium,NO,,,Governance & Policy,Maintain Contact with Interest Groups,Not Started
INT-A5-34,ISO27001_2022,A.5.6,governance,Information or advisories from special interest groups are shared internally with relevant stakeholders,Internal communications or threat sharing records,medium,NO,,,Governance & Policy,Maintain Contact with Interest Groups,Not Started
INT-A5-35,ISO27001_2022,A.5.7,governance,Methods are defined for collecting information on existing and emerging security threats,Threat intelligence policy or procedure,medium,NO,,,Governance & Policy,Collect and Analyze Threat Intelligence,Not Started
INT-A5-36,ISO27001_2022,A.5.7,governance,Sources of threat intelligence are identified and used by the organization,Threat feeds subscriptions or ISAC participation,medium,NO,,,Governance & Policy,Collect and Analyze Threat Intelligence,Not Started
INT-A5-37,ISO27001_2022,A.5.7,governance,Threat intelligence information is analyzed by the organization,Analysis records or reports,medium,NO,,,Governance & Policy,Collect and Analyze Threat Intelligence,Not Started
INT-A5-38,ISO27001_2022,A.5.7,governance,Threat intelligence is used to support risk assessment incident response or security improvements,Risk register updates or incident records,medium,NO,,,Governance & Policy,Collect and Analyze Threat Intelligence,Not Started
INT-A5-39,ISO27001_2022,A.5.7,governance,Threat intelligence reports have been received or generated within the last 12 months,Threat intelligence reports,medium,NO,,,Governance & Policy,Collect and Analyze Threat Intelligence,Not Started
INT-A5-40,ISO27001_2022,A.5.8,governance,Information security is formally integrated into project management processes,Project or risk management procedures,medium,NO,,,Governance & Policy,Integrate Security into Project Management,Not Started
INT-A5-41,ISO27001_2022,A.5.8,governance,Project documentation includes requirements for managing information security risks,Project templates or procedures,medium,NO,,,Governance & Policy,Integrate Security into Project Management,Not Started
INT-A5-42,ISO27001_2022,A.5.8,governance,Information security requirements for projects are communicated to relevant personnel,Training or project communications,medium,NO,,,Governance & Policy,Integrate Security into Project Management,Not Started
INT-A5-43,ISO27001_2022,A.5.8,governance,Project teams define information security requirements for projects,Project documentation,medium,NO,,,Governance & Policy,Integrate Security into Project Management,Not Started
INT-A5-44,ISO27001_2022,A.5.8,governance,Project security requirements are specific measurable and reasonable,Project risk assessments,medium,NO,,,Governance & Policy,Integrate Security into Project Management,Not Started
INT-A5-45,ISO27001_2022,A.5.8,governance,Project security requirements align with the organizational security baseline,Baseline standards or project records,medium,NO,,,Governance & Policy,Integrate Security into Project Management,Not Started
INT-A5-46,ISO27001_2022,A.5.9,governance,An asset management process is documented and implemented,Asset management policy or procedure,medium,NO,,,Governance & Policy,Inventory Information Assets,Not Started
INT-A5-47,ISO27001_2022,A.5.9,governance,An inventory of information and associated assets is maintained,Asset inventory register,medium,NO,,,Governance & Policy,Inventory Information Assets,Not Started
INT-A5-48,ISO27001_2022,A.5.9,governance,Information assets are clearly identified,Asset inventory records,medium,NO,,,Governance & Policy,Inventory Information Assets,Not Started
INT-A5-49,ISO27001_2022,A.5.9,governance,Information assets are classified based on criticality or CIA considerations,Asset classification records,medium,NO,,,Governance & Policy,Inventory Information Assets,Not Started
INT-A5-50,ISO27001_2022,A.5.9,governance,Ownership is defined for all information assets,Asset ownership records,medium,NO,,,Governance & Policy,Inventory Information Assets,Not Started
INT-A5-51,ISO27001_2022,A.5.9,governance,The asset inventory has been reviewed within defined review periods,Review logs or version history,medium,NO,,,Governance & Policy,Inventory Information Assets,Not Started
INT-A5-52,ISO27001_2022,A.5.10,governance,Acceptable use rules for information and associated assets are documented,Acceptable use policy,medium,NO,,,Governance & Policy,Define Acceptable Use of Assets,Not Started
INT-A5-53,ISO27001_2022,A.5.10,governance,Asset handling procedures are defined in accordance with the classification scheme,Asset handling procedures,medium,NO,,,Governance & Policy,Define Acceptable Use of Assets,Not Started
INT-A5-54,ISO27001_2022,A.5.10,governance,Acceptable use rules are communicated to relevant personnel,Training records or emails,medium,NO,,,Governance & Policy,Define Acceptable Use of Assets,Not Started
INT-A5-55,ISO27001_2022,A.5.10,governance,Personnel acknowledge acceptable use requirements,Signed acknowledgements or onboarding records,weak,NO,,,Governance & Policy,Define Acceptable Use of Assets,Not Started
INT-A5-56,ISO27001_2022,A.5.10,governance,Acceptable use documentation has been reviewed within defined timeframes,Version history or review records,medium,NO,,,Governance & Policy,Define Acceptable Use of Assets,Not Started
INT-A5-57,ISO27001_2022,A.5.11,governance,A process exists requiring return of organizational assets upon termination or contract end,Offboarding or termination procedures,medium,NO,,,Governance & Policy,Return Assets Upon Termination,Not Started
INT-A5-58,ISO27001_2022,A.5.11,governance,Records of asset return are maintained for terminated or transferred personnel,Asset return or offboarding records,medium,NO,,,Governance & Policy,Return Assets Upon Termination,Not Started
INT-A5-59,ISO27001_2022,A.5.12,governance,An information classification scheme defining protection levels exists,Information classification policy,medium,NO,,,Governance & Policy,Classify Information,Not Started
INT-A5-60,ISO27001_2022,A.5.12,governance,The classification scheme considers confidentiality integrity availability and business requirements,Classification policy or procedure,medium,NO,,,Governance & Policy,Classify Information,Not Started
INT-A5-61,ISO27001_2022,A.5.12,governance,Asset owners are responsible for assigning and reviewing information classification,Classification procedures,medium,NO,,,Governance & Policy,Classify Information,Not Started
INT-A5-62,ISO27001_2022,A.5.12,governance,The classification scheme addresses aggregation of information resulting in higher classification,Classification policy,medium,NO,,,Governance & Policy,Classify Information,Not Started
INT-A5-63,ISO27001_2022,A.5.12,governance,A defined frequency exists to review and update the classification scheme,Classification policy,medium,NO,,,Governance & Policy,Classify Information,Not Started
INT-A5-64,ISO27001_2022,A.5.12,governance,The information classification scheme has been reviewed within defined timeframes,Version history or review records,medium,NO,,,Governance & Policy,Classify Information,Not Started
INT-A5-65,ISO27001_2022,A.5.12,governance,Information classification requirements are communicated to relevant personnel,Training records or communications,medium,NO,,,Governance & Policy,Classify Information,Not Started
INT-A5-66,ISO27001_2022,A.5.13,governance,Procedures exist for labeling information in accordance with the classification scheme,Information labeling procedure,medium,NO,,,Governance & Policy,Label Information,Not Started
INT-A5-67,ISO27001_2022,A.5.13,governance,A default classification level is defined for unlabeled information,Labeling procedure,medium,NO,,,Governance & Policy,Label Information,Not Started
INT-A5-68,ISO27001_2022,A.5.13,governance,A defined frequency exists to review and update information labeling procedures,Labeling procedure,medium,NO,,,Governance & Policy,Label Information,Not Started
INT-A5-69,ISO27001_2022,A.5.13,governance,Information labeling procedures have been reviewed within defined timeframes,Version history or review records,medium,NO,,,Governance & Policy,Label Information,Not Started
INT-A5-70,ISO27001_2022,A.5.13,governance,Information labeling requirements are communicated to relevant personnel,Training records or communications,medium,NO,,,Governance & Policy,Label Information,Not Started
INT-A5-71,ISO27001_2022,A.5.13,operational,Information assets are labeled in accordance with the classification scheme,Labeled information samples,medium,NO,,,Governance & Policy,Label Information,Not Started
INT-A5-72,ISO27001_2022,A.5.14,governance,Information transfer rules and procedures are documented,Information transfer policy or procedure,medium,NO,,,Governance & Policy,Secure Information Transfer,Not Started
INT-A5-73,ISO27001_2022,A.5.14,governance,Protection measures for information transfer are defined for communication facilities,Transfer procedures,medium,NO,,,Governance & Policy,Secure Information Transfer,Not Started
INT-A5-74,ISO27001_2022,A.5.14,governance,A defined frequency exists to review and update information transfer documentation,Transfer policy,medium,NO,,,Governance & Policy,Secure Information Transfer,Not Started
INT-A5-75,ISO27001_2022,A.5.14,governance,Information transfer documentation has been reviewed within defined timeframes,Version history or review records,medium,NO,,,Governance & Policy,Secure Information Transfer,Not Started
INT-A5-76,ISO27001_2022,A.5.14,governance,Information transfer requirements are communicated to relevant personnel,Training records or communications,medium,NO,,,Governance & Policy,Secure Information Transfer,Not Started
INT-A5-77,ISO27001_2022,A.5.14,technical,Data transmitted over external networks is encrypted using strong cryptography,System or network configuration,strong,NO,,,Governance & Policy,Secure Information Transfer,Not Started
INT-A5-78,ISO27001_2022,A.5.14,technical,Encryption strength used for information transfer meets defined security requirements,Encryption standards or system configuration,strong,NO,,,Governance & Policy,Secure Information Transfer,Not Started
INT-A5-79,ISO27001_2022,A.5.14,governance,Agreements governing secure information transfer with external parties exist,Contracts or agreements,medium,NO,,,Governance & Policy,Secure Information Transfer,Not Started
INT-A5-80,ISO27001_2022,A.5.14,technical,Information transfers are protected based on information classification,Security controls or transfer records,strong,NO,,,Governance & Policy,Secure Information Transfer,Not Started
INT-A5-81,ISO27001_2022,A.5.15,governance,An access control policy defining access requirements exists,Access control policy,medium,NO,,,Governance & Policy,Control Access to Information,Not Started
INT-A5-82,ISO27001_2022,A.5.15,governance,Access request approval and provisioning requirements are defined,Access control policy,medium,NO,,,Governance & Policy,Control Access to Information,Not Started
INT-A5-83,ISO27001_2022,A.5.15,technical,Access provisioning follows role-based and least privilege principles,IAM configuration or access records,strong,NO,,,Governance & Policy,Control Access to Information,Not Started
INT-A5-84,ISO27001_2022,A.5.15,governance,Management requirements for functional or non-human identities are defined,Access control policy or IAM records,medium,NO,,,Governance & Policy,Control Access to Information,Not Started
INT-A5-85,ISO27001_2022,A.5.15,governance,A defined frequency exists to review and update access control documentation,Access control policy,medium,NO,,,Governance & Policy,Control Access to Information,Not Started
INT-A5-86,ISO27001_2022,A.5.15,governance,Access control policy has been reviewed within defined timeframes,Version history or review records,medium,NO,,,Governance & Policy,Control Access to Information,Not Started
INT-A5-87,ISO27001_2022,A.5.15,governance,Access control requirements are communicated to relevant personnel,Training records or communications,medium,NO,,,Governance & Policy,Control Access to Information,Not Started
INT-A5-88,ISO27001_2022,A.5.15,technical,Access to networks and network services is assigned based on job role and function,Network or IAM configuration,strong,NO,,,Governance & Policy,Control Access to Information,Not Started
INT-A5-89,ISO27001_2022,A.5.16,governance,A formal identity registration and de-registration process exists,Identity management procedures,medium,NO,,,Governance & Policy,Manage Identity Lifecycle,Not Started
INT-A5-90,ISO27001_2022,A.5.16,operational,Identity onboarding processes support assignment of access rights,IAM onboarding records,medium,NO,,,Governance & Policy,Manage Identity Lifecycle,Not Started
